{
  "type": "governance-state",
  "gaamVersion": "0.9.0",
  "status": "experimental",
  "normativeStatus": "non-normative",
  "systemId": "registry:001",
  "state": "status-only",
  "effectiveAt": "2026-07-29T00:00:00Z",
  "permittedOperations": [
    "status-query",
    "revocation-update"
  ],
  "trigger": "issuance-provider-outage"
}
